{
  "security_summary": "No critical issues were found in the current wallet session flow, but device-level validation and stronger storage hardening remain open.",
  "scope": [
    "lib/services/wallet_session_store.dart",
    "lib/services/solana_mobile_wallet_service.dart"
  ],
  "findings": [
    {
      "severity": "medium",
      "area": "wallet session persistence",
      "issue": "Session state is persisted through standard app storage without an additional hardening layer.",
      "exploit_path": "A compromised or rooted environment may expose persisted session material more easily than hardened storage would.",
      "remediation": "Evaluate whether sensitive session fields should move to a stronger storage mechanism before production rollout."
    }
  ],
  "verified_strengths": [
    "No secrets are hardcoded in repository source",
    "Wallet connection flow is gated behind explicit session handling"
  ],
  "verification": [
    {
      "check": "Source inspection",
      "result": "pass",
      "evidence": "No hardcoded credentials found in scoped files"
    },
    {
      "check": "Android device wallet validation",
      "result": "not-run",
      "evidence": "Manual device verification still pending"
    }
  ],
  "residual_risks": [
    "Production confidence remains limited until real-device wallet validation is completed"
  ]
}
